[
  {
    "id": "model_vs_harness",
    "n": "01",
    "whatHappened": "You picked two cards, not one. The stat line you're playing with is the product of both.",
    "whyItWorks": "A model takes text in and produces text out. It has no memory between calls, no ability to run anything, and no loop. Everything else — the prompt construction, the tool surface, context management, error recovery, when to stop — is the harness. Change the harness on a fixed model and the outcome moves further than changing the model on a fixed harness.",
    "inYourJob": "When a Claude Code run underperforms, audit the harness before you swap the model: the tool definitions, the context assembly, the stop condition. Most of what gets reported as a model problem is a harness problem with better branding.",
    "link": "https://addyosmani.com/blog/agent-harness-engineering/"
  },
  {
    "id": "harness_variance",
    "n": "02",
    "whatHappened": "You swapped only the harness, kept the model, and watched your own run's numbers move.",
    "whyItWorks": "Published comparisons and practitioner experience agree: scaffolding differences produce larger outcome swings than model differences of a generation or more. The same model inside a tool-rich, recovery-capable harness completes work that the bare version cannot start. This is also why benchmark results transfer poorly — a harness tuned to a benchmark is not tuned to your repository.",
    "inYourJob": "Before paying for a bigger model, spend one afternoon on the harness you have: sharper tool definitions, a real verifier command, a tighter CLAUDE.md. Measure on your own repository, not on a leaderboard.",
    "link": "https://www.mindstudio.ai/blog/agent-harness-scaffolding-matters-more-than-model"
  },
  {
    "id": "agentic_loop",
    "n": "03",
    "whatHappened": "You assembled a cycle — act, observe, decide, repeat — and it reached a goal that a single request could not.",
    "whyItWorks": "One-shot prompting plateaus because the model cannot see the consequences of its own output. A loop feeds results back in: the agent acts, captures what actually happened, and adjusts. The unit of design stops being the prompt and becomes the cycle — what enters each iteration, what is checked, and what ends it. Contrast the loop with a graph: a loop iterates until a verifier passes, which makes it the right shape under uncertainty; a graph runs a predetermined DAG of steps, predictable in cost and brittle to surprises. Real systems are usually graphs whose nodes are loops.",
    "inYourJob": "When a task fails as one big prompt, restructure it as a loop: give Claude Code the failing command and let it edit, run, read, and retry. Design the iteration — what enters it, what checks it, what ends it — not the wording.",
    "link": "https://www.ibm.com/think/topics/loop-engineering"
  },
  {
    "id": "verifier_machine_checkable",
    "n": "04",
    "whatHappened": "The pass was impassable until your loop contained a check that could actually fail the work.",
    "whyItWorks": "An agent without a verifier optimises for appearing done, because appearing done is all it can observe. A machine-checkable criterion — a test suite, a compiler, a schema validation — gives the loop an exit condition that cannot be talked into agreement. Subjective checks (\"looks good\") either never terminate or terminate on confidence rather than correctness.",
    "inYourJob": "A verifier is a command with an exit code: tests, build, lint, schema check. 'Looks right' is not a verifier. Write the command that can fail the work before you launch the agent; if it does not exist, build it first — that is the highest-leverage hour of the whole job.",
    "link": "https://www.augmentcode.com/guides/what-is-loop-engineering"
  },
  {
    "id": "stop_conditions",
    "n": "05",
    "whatHappened": "A loop without a cap ran until something external stopped it. The something external was your budget.",
    "whyItWorks": "Every production loop needs three exits: success (the verifier passes), an iteration cap (progress has stalled), and a budget cap (the attempt has cost enough). Success-only loops run forever on impossible tasks. Cap-only loops quit early on hard ones. All three together make failure loud, bounded, and cheap.",
    "inYourJob": "In claude-code-action, set --max-turns and a spend budget before you set anything else. Treat a hit cap as a signal to redesign the task, never as a reason to raise the cap.",
    "link": "https://code.claude.com/docs/en/github-actions"
  },
  {
    "id": "context_budget",
    "n": "06",
    "whatHappened": "The wagon had a weight limit. So does the window. You chose what to carry and the choice was the work.",
    "whyItWorks": "Context is a budget, not a container. Everything you include competes for the model's attention with everything else, and low-relevance bulk actively degrades performance on the high-relevance items. The skill is assembly: the conventions file, the failing output, and the files that changed usually beat the full directory tree by a wide margin.",
    "inYourJob": "Assemble context like it costs something, because it does: CLAUDE.md for standing conventions, the failing output, the three files that changed. When you catch yourself pasting the repository, ask what one-line fact you actually needed from it.",
    "link": "https://magazine.sebastianraschka.com/p/components-of-a-coding-agent"
  },
  {
    "id": "compaction_lossy",
    "n": "07",
    "whatHappened": "You compacted an item to make it fit, and a requirement you needed later was in the part that didn't survive.",
    "whyItWorks": "Summarisation is lossy compression with no error message. Each compaction pass discards detail chosen by a model that does not know which detail your future self needs. Requirements, constraints, and decisions are exactly the small facts that vanish, because they look like background.",
    "inYourJob": "Keep hard constraints in a file the loop re-reads — CLAUDE.md, the task spec — rather than trusting them to the conversation. Anything that must survive /compact has no business living only in chat history.",
    "link": "https://code.claude.com/docs/en/memory"
  },
  {
    "id": "subagents_isolate",
    "n": "08",
    "whatHappened": "You sent a scout at the 900-line log. It read the noise in its own context and returned one line you could afford.",
    "whyItWorks": "A subagent runs with its own separate context window and returns only a summary. The noisy exploration — reading logs, scanning a legacy module, trying approaches — happens in the disposable context, and the main loop pays one slot for the conclusion. This converts huge, low-density inputs into small, high-density ones.",
    "inYourJob": "Give noisy exploration to a subagent; its context dies with it, its summary survives. In Claude Code that is a custom agent in .claude/agents with its own window — keep the main context for decisions, not raw material.",
    "link": "https://code.claude.com/docs/en/sub-agents"
  },
  {
    "id": "root_cause_vs_symptom",
    "n": "09",
    "whatHappened": "You shot symptoms and they respawned in pairs. The root cause was camouflaged, moved when observed, and paid out enormously.",
    "whyItWorks": "Fixing a symptom leaves the mechanism that produces symptoms intact, so the work recurs with interest. Root causes are more expensive to find — they require tracing, hypothesis, and verification — but eliminating one retires an entire family of future incidents. Agents amplify this: point one at symptoms and it will happily fix the wrong thing at scale.",
    "inYourJob": "Spend your own effort on localisation before dispatching the agent: which layer, which mechanism. An agent aimed at a root cause is leverage; aimed at a symptom, it is a symptom factory with an API bill.",
    "link": "https://adtmag.com/articles/2026/07/01/loop-engineering-emerges-as-developers-put-ai-coding-agents-on-repeat.aspx"
  },
  {
    "id": "summarise_findings",
    "n": "10",
    "whatHappened": "You shot more than you could carry. The payout read your one-line summaries, not your bag.",
    "whyItWorks": "Raw findings do not fit — not in a context window, not in a handoff, not in a colleague's attention. The compression step is where value is created or destroyed: a specific one-line summary (what breaks, where, under what condition) survives every downstream budget, while a vague one is indistinguishable from noise and gets discarded.",
    "inYourJob": "End every agent investigation with the one-line version of each finding: what breaks, where, under what condition. A subagent's summary is the only part of its work that survives — write it like it is the deliverable, because it is.",
    "link": "https://magazine.sebastianraschka.com/p/components-of-a-coding-agent"
  },
  {
    "id": "risk_gates",
    "n": "11",
    "whatHappened": "You chose among four crossings with genuinely different risk profiles, and the ceremonial option was not the safe one.",
    "whyItWorks": "A control is only real if it can fail the thing it reviews. A test gate that blocks bad merges is a control; a review board that has never rejected anything is a ritual with a queue. Real controls are typically deterministic, automated, and close to the change. Rituals are typically human, scheduled, and far from it — and their cost is paid whether or not they catch anything.",
    "inYourJob": "Inventory your gates: for each, ask when it last failed something. Keep the ones with a record; convert the rest into automated checks — branch protection, CI verifiers, gh-aw approval gates — that run on every change instead of convening on Thursdays.",
    "link": "https://github.com/github/gh-aw"
  },
  {
    "id": "feature_flags",
    "n": "12",
    "whatHappened": "You caulked the wagon and floated it dark: the change shipped, disabled, and you turned it on from dry land.",